content,image_url,A,B,C,D,correct_answer,difficulty,knowledge_point_ids,source_tag
在TCP三次握手中关于第三次报文段的常见说法是,,"第三次只能发送不含数据的纯ACK","第三次ACK段在协议上允许携带应用层数据且实践中常与首包数据合并发送","第三次必须携带SYN","第三次用于协商窗口扩大因子",B,0.45,1,教师自编-网络
某系统采用二级页表且逻辑地址为32位页内偏移占12位则页目录项与页表项共占多少位用于页号划分,,"8位","10位","20位","22位",C,0.52,1,教师自编-操作系统
下列关于二叉搜索树BST的叙述正确的是,,"中序遍历得到的关键字序列一定按非降序排列当树中无重复键时严格递增","先序遍历序列一定有序","任意结点的左右子树高度差不超过1","插入新结点必导致树高加1",A,0.48,1,教师自编-数据结构
对n个顶点e条边的有向图用邻接表存储求单源最短路径若所有边权非负采用Dijkstra算法的二叉堆实现时其时间复杂度为,,"O(n^2)","O((n+e)log n)","O(ne)","O(n+e)",B,0.58,1,教师自编-图论算法
关系模式R(A,B,C)上函数依赖集F={A→B,B→C}则R最高满足,,"1NF","2NF","3NF","BCNF",B,0.44,1,教师自编-数据库
